ID,Author,ScientificName,lon,lat,alt,site,country,continent,biome,ymean_temp,ymean_prec,ymean_pet,soil_type,sample_date,growth_form,leaf_phenology,sun_shade,dbh,height,a_amax,a_gsw,a_vcmax,a_jmax,a_rdmax,m_amax,SLA,wood_dens,leaf_carbon,leaf_nitrogen,leaf_phosphorus,wood_hydcond,xylem_p12,xylem_p50,xylem_p88,leaf_psi_tlp,experiment,reference,doi,Notes
1,Lore Verryckt,Eschweilera coriacea,-52.683,4.033,110,GF-NOU,French Guiana,South America,06 - Tropical Moist Forest,26.3,2990,,03 - Sandy Loam,2019-05-20,Tree,,02 - Partially Shaded,,,,,10.114,25.358,1.156,,10.78,,492.59,15.44,0.489,,,,,,Nitrogen addition,Verryckt LT; Vicca S; van Langenhove L et al. 2022. Vertical profiles of leaf photosynthesis and leaf traits and soil nutrients in two tropical rainforests in French Guiana before and after a 3-year nitrogen and phosphorus addition experiment. Earth Syst. Sci. Data 14; 5-18; doi:10.5194/essd-14-5-2022,https://doi.org/10.5194/essd-14-5-2022,Bottom branch
2,Lore Verryckt,Eperua falcata,-52.683,4.033,110,GF-NOU,French Guiana,South America,06 - Tropical Moist Forest,26.3,2990,,03 - Sandy Loam,2019-05-20,Tree,,02 - Partially Shaded,,,,,4.59,21.561,0.68,,15.40,,507.15,15.44,0.889,,,,,,Nitrogen addition,Verryckt LT; Vicca S; van Langenhove L et al. 2022. Vertical profiles of leaf photosynthesis and leaf traits and soil nutrients in two tropical rainforests in French Guiana before and after a 3-year nitrogen and phosphorus addition experiment. Earth Syst. Sci. Data 14; 5-18; doi:10.5194/essd-14-5-2022,https://doi.org/10.5194/essd-14-5-2022,Bottom branch
3,Lore Verryckt,Eugenia cucullata,-52.683,4.033,110,GF-NOU,French Guiana,South America,06 - Tropical Moist Forest,26.3,2990,,03 - Sandy Loam,2015-05-20,Tree,,02 - Partially Shaded,,,,,,,,,6.07,,480.80,12.18,0.367,,,,,,Phosphorus addition,Verryckt LT; Vicca S; van Langenhove L et al. 2022. Vertical profiles of leaf photosynthesis and leaf traits and soil nutrients in two tropical rainforests in French Guiana before and after a 3-year nitrogen and phosphorus addition experiment. Earth Syst. Sci. Data 14; 5-18; doi:10.5194/essd-14-5-2022,https://doi.org/10.5194/essd-14-5-2022,Bottom branch
4,Sebastien Levionnois,Cecropia obtusa,-53.175,5.414,49,GF-CNM,French Guiana,South America,06 - Tropical Moist Forest,25.7,3041,,03 - Sandy Loam,2015-04-16,Tree,,03 - Mostly Sun-Exposed,,,17.88,333,,,,170,9.4,,,,,0.04591,,,,,Natural,"Levionnois, S; 2019. Diversite et variabilite de l.architecture vasculaire et hydraulique de la pousse feuillee chez des arbres de canopee d.une foret tropicale humide. Ph.D. thesis; University of French Guiana; Cayenne; Guyane; France. https://tel.archives-ouvertes.fr/tel-02928247.",https://tel.archives-ouvertes.fr/tel-02928247,Listed data from wet and dry season (species average). Assumed high light because the species is a gap specialist and very shade intolerant
5,Camille Ziegler,Iryanthera sagotiana,-52.928,5.272,48,GF-PRC,French Guiana,South America,06 - Tropical Moist Forest,25.7,3102,,03 - Sandy Loam,2017-04-01,Tree,Evergreen,03 - Mostly Sun-Exposed,,,,,,,,,,,,,,,-1.30,-3.69,-6.08,-1.54,Natural,Ziegler C; Coste S; Stahl C et al. 2019. Large hydraulic safety margins protect neotropical canopy rainforest tree species against hydraulic failure during drought. Ann. For. Sci. 76; 115; doi:10.1007/s13595-019-0905-0.,https://doi.org/10.1007/s13595-019-0905-0,
6,Camille Ziegler,Sextonia rubra,-52.670,5.170,11,GF-KOU,French Guiana,South America,06 - Tropical Moist Forest,29.2,,,03 - Sandy Loam,2018-11-02,Tree,,01 - Mostly Shaded,1.08,0.74,5.8,491,,,,,18.18,,475.00,12.20,,,-1.1,-2.3,-3.7,-1.8,Potted; well watered and understorey light,Ziegler C; 2021. Diversite des mecanismes de resistance a la secheresse des arbres en foret tropicale humide. Ph.D. thesis; University of Lorraine; Nancy; Lorraine; France. URL https://hal.univ-lorraine.fr/tel-03338863,https://hal.univ-lorraine.fr/tel-03338863,This is an experiment; only data from the control are reported (but they are still potted plants). Heritiera utilis data were removed because this species is not native from Neotropics. Average temperature measured at the glasshouse
7,Andres Gonzalez-Melo,Bagassa guianensis,-52.928,5.272,48,GF-PRC,French Guiana,South America,06 - Tropical Moist Forest,25.7,3102,,06 - Sandy Clay Loam,2018-03-01,Tree,Deciduous (not specified),,,,,,,,,,,0.7327,,,,,,,,,,Gonzales-Melo A; Posada JM; Beauchene J et al. 2022. Radial variations in wood functional traits in a rain forest from eastern Amazonia. Trees 36; 569-581; doi:10.1007/s00468-021-02229-1,https://doi.org/10.1007/s00468-021-02229-1,
8,Andres Gonzalez-Melo,Lecythis persistens,-52.928,5.272,48,GF-PRC,French Guiana,South America,06 - Tropical Moist Forest,25.7,3102,,06 - Sandy Clay Loam,2018-03-01,Tree,Evergreen,,,,,,,,,,,0.8626,,,,,,,,,,Gonzales-Melo A; Posada JM; Beauchene J et al. 2022. Radial variations in wood functional traits in a rain forest from eastern Amazonia. Trees 36; 569-581; doi:10.1007/s00468-021-02229-1,https://doi.org/10.1007/s00468-021-02229-1,
